{"concise_reason": "minimal target-scoped live-evidence patch", "confidence": 0.95, "drift_category": "SED", "evidence_refs": ["live-1984f7860d8db799ff22-EV005", "live-1984f7860d8db799ff22-EV011", "live-1984f7860d8db799ff22-EV016"], "expected_agent_behavior_change": "adapt the displayed tool contract using only the cited live evidence", "location_path": "/paths/~1repositories~1{repo_id}~1issues~1{issue_id}~1close/post/x-state-effects", "openapi_operations": [{"evidence_refs": ["live-1984f7860d8db799ff22-EV005", "live-1984f7860d8db799ff22-EV011", "live-1984f7860d8db799ff22-EV016"], "op": "add", "path": "/paths/~1repositories~1{repo_id}~1issues~1{issue_id}~1close/post/x-driftguard-observation-policy", "reason_code": "LIVE_EVIDENCE_MINIMAL_CHANGE", "value": {"condition": "state=closed", "confirmation_tool": "get_issue", "kind": "read_after_write"}}], "semantic_extensions": {"x-driftguard-patch-semantics": {"after": ["close_issue", "get_issue", "verify state=closed"], "before": ["close_issue"], "observation_policy": {"condition": "state=closed", "confirmation_tool": "get_issue", "kind": "read_after_write"}, "operation": "add_postcondition_verification", "target": "/adapter/close_issue/postcondition"}}, "target_tool_id": "close_issue"}
